{
  "schemaVersion": "1.0",
  "classifiers": [
    {
      "id": "c:App",
      "name": "App",
      "qualifiedName": "App",
      "packageId": null,
      "kind": "COMPONENT",
      "visibility": "PUBLIC",
      "attributes": [],
      "operations": [],
      "stereotypes": [
        {
          "name": "ReactComponent",
          "qualifiedName": null
        }
      ],
      "taggedValues": [
        {
          "key": "framework",
          "value": "react"
        },
        {
          "key": "react.componentKind",
          "value": "function"
        },
        {
          "key": "react.hooks",
          "value": "useState,useEffect"
        }
      ],
      "source": {
        "file": "src/App.tsx",
        "line": 1,
        "col": 1
      },
      "stereotypeRefs": [
        {
          "stereotypeId": "st:react.ReactComponent",
          "values": {}
        }
      ]
    },
    {
      "id": "c:Header",
      "name": "Header",
      "qualifiedName": "Header",
      "packageId": null,
      "kind": "COMPONENT",
      "visibility": "PUBLIC",
      "attributes": [],
      "operations": [],
      "stereotypes": [
        {
          "name": "ReactComponent",
          "qualifiedName": null
        }
      ],
      "taggedValues": [
        {
          "key": "framework",
          "value": "react"
        },
        {
          "key": "react.componentKind",
          "value": "function"
        }
      ],
      "source": {
        "file": "src/Header.tsx",
        "line": 1,
        "col": 1
      },
      "stereotypeRefs": [
        {
          "stereotypeId": "st:react.ReactComponent",
          "values": {}
        }
      ]
    }
  ],
  "relations": [
    {
      "id": "r:render:App->Header",
      "kind": "RENDER",
      "sourceId": "c:App",
      "targetId": "c:Header",
      "name": null,
      "stereotypes": [],
      "taggedValues": [
        {
          "key": "origin",
          "value": "jsx"
        }
      ],
      "source": null
    }
  ],
  "stereotypeDefinitions": [
    {
      "id": "st:react.ReactComponent",
      "name": "ReactComponent",
      "qualifiedName": null,
      "profileName": "Frontend",
      "appliesTo": [
        "Class"
      ],
      "properties": []
    }
  ]
}
